{
  "game": "mshvsf",
  "character": "ryu",
  "context": "post_fight",
  "quote_id": "unknown_001",
  "status": "UNKNOWN",
  "saturn_jp_text": "",
  "arcade_us_text": "",
  "ps1_us_text": "",
  "preferred_english": "",
  "evidence": [],
  "notes": "Template only; no cross-release correspondence has been established."
}
