{
  "game": "mshvsf",
  "character": "ryu",
  "context": "post_fight win quote; Saturn JP T-1238G; arcade mode; team Ryu/Ken (P1) vs Vega; Ryu on point and landing the KO; joint Ryu/Ken win portrait",
  "quote_id": "ryu_q10",
  "status": "CONFIRMED",
  "saturn_jp_text": "一瞬の迷いが拳を鈍らせる\n考えるな！自分を信じろ‼",
  "arcade_us_text": "Look into your soul in\norder to find the way.",
  "ps1_us_text": "Look into your soul in\norder to find the way.",
  "preferred_english": "Look into your soul in\norder to find the way.",
  "evidence": [
    {
      "reference": "EXP-0010 slot 7 state (SHA-256 9482880a11269e5ce630179db70bc1833375ee39d30af2ab84161a265a6a47ce), save-time thumbnail f8ea9bb0372f94494456aa7869789c10e86fe386ae4642b8f857e929b0dd2d63",
      "supports": "Q10 (opening characters 一瞬の迷いが) is on screen in the C1 checkpoint"
    },
    {
      "reference": "EXP-0010 reload screenshots -0037.png (78320b69e213e961ec8527f3f30bd447642352659e116eded5323b4768f05974) and -0038.png (d526c63629268a62ae21c6e06d012d5f74a89c797716a859e6a17ed8c15710c5)",
      "supports": "the slot-7 checkpoint reloads to the same visible Q10 caption"
    },
    {
      "reference": "EXP-0010 slot 0 state (SHA-256 f02c7177dadcaa43f70147a85c5dd350b8f6e262801ae2b7613868da4a49f93c)",
      "supports": "a same-quote, frame-offset control (C1′) for Q10 exists"
    },
    {
      "reference": "REF-003 / EXP-0031: offline render of MC09.PAC record 8 (tools/text/quote_render.py) and arcade mshvsfj on-screen display of the byte-identical record (index forced to 8)",
      "supports": "saturn_jp_text: two independent transcriptions identical; kana, punctuation and cell counts machine-checked against the record codes"
    },
    {
      "reference": "EXP-0031: MC09.PAC table 0x91AC (16 x 76 bytes) is byte-identical to the arcade Japanese Ryu table at 0x20EDAC (slot 9 of pointer table 0x20BFAC) in mshvsf, mshvsfu and mshvsfj",
      "supports": "Saturn record 8 is arcade Japanese record 8"
    },
    {
      "reference": "EXP-0031: arcade selection routine (mshvsfu 0x070328-0x070380) masks the random value to 0-15 and, in non-Japanese languages, remaps it through the table 00 01 02 03 04 05 06 07 00 01 02 03 04 05 06 07; breakpoint-set pre-mask values 12 and 9 stored index 4 and 1 on mshvsfu and 12 and 9 on mshvsfj",
      "supports": "the arcade shows English slot 9 entry 0 in the same game state in which it shows Japanese record 8"
    },
    {
      "reference": "EXP-0031: mshvsfu with index forced to 0 displayed 'Look into your soul in / order to find the way.' (entry at 0x21BA20)",
      "supports": "arcade_us_text exact wording and line break"
    },
    {
      "reference": "EXP-0032: SLUS-00793 DAT/SELECT.BIN (SHA-256 c78b150212b1f1a7…) contains arcade slot 9's 800-byte English block byte-identical (16-bit codes, little-endian) at offset 0x1150C",
      "supports": "ps1_us_text equals arcade_us_text (data identity; PS1 display not captured)"
    },
    {
      "reference": "EXP-0033: build/tr001 (track 01 SHA-256 2941a9c5…4719), record 8 forced after one Ryu KO; verify_records all checks OK, screen IoU 1.0",
      "supports": "preferred_english displays on the Saturn as record 8 from a rebuilt image"
    }
  ],
  "notes": "Saturn record 8 (Q10). Correspondence type: game-logic index, CONFIRMED (EXP-0031). In the same selection state the Japanese arcade shows this record and the English arcade shows slot 9 entry 0. Saturn records 0 and 8 both pair with entry 0, because English has 8 entries per character for Japanese's 16. This is not a claim that the English line translates the Japanese: Capcom's English set is a separate rewrite. Reading only, not evidence: entry 4 ('Unless you believe in yourself, you cannot win!') is closer in meaning to this record. Policy (user decision, 2026-10-24): use the official paired English, so preferred_english = arcade_us_text, filled when GATE-TRANSLATION passed on 2026-10-24 (user GO). Table record (RE-021, EXP-0024): decoded MC09.PAC record 8 at WRAM-L 0x0020940C. ps1_us_text: identical to the arcade by data (EXP-0032); PS1 display not captured."
}
